{
  "id": "k-l5",
  "lesson": [
    "Phần 5 Nghe là một hội thoại dài. Có 5 người (hoặc 5 ngày, 5 nơi) và 8 lựa chọn A–H. Bạn ghép mỗi người với một lựa chọn; 3 lựa chọn thừa.",
    "Lựa chọn thừa thường vẫn được nhắc trong hội thoại để gây nhiễu."
  ],
  "steps": [
    "Đọc 5 tên và 8 lựa chọn trước.",
    "Nghe theo thứ tự tên; mỗi tên được nói đến lần lượt.",
    "Ghép khi người nói chốt; bỏ qua lựa chọn bị nhắc rồi gạt đi ('not the book, she's got that').",
    "Mỗi lựa chọn chỉ dùng một lần."
  ],
  "tips": [
    "Gạch lựa chọn đã dùng để thu hẹp các câu sau.",
    "Nghe đại từ (he / she / they) để biết đang nói về ai.",
    "Câu hỏi đi theo thứ tự tên trong danh sách; nghe thấy tên tiếp theo là chuyển câu."
  ],
  "traps": [
    "Ghép theo lựa chọn được nhắc đầu tiên khi nói về người đó.",
    "Dùng một lựa chọn cho hai người."
  ],
  "time": "khoảng 3 phút"
}
