{
  "id": "v-l3",
  "lesson": [
    "Phần 3 Nghe VSTEP có 3 bài nói dài (bài giảng, bài nói chuyện, phỏng vấn) về chủ đề học thuật hoặc xã hội, mỗi bài 5 câu hỏi 4 phương án, tổng 15 câu. Nghe một lần.",
    "Đây là phần khó nhất: bài dài, từ vựng học thuật, câu hỏi về ý chính, chi tiết, ví dụ minh hoạ cho điều gì, và quan điểm của người nói.",
    "Người nói thường dùng từ báo hiệu cấu trúc: 'firstly', 'another reason', 'for example', 'however', 'in conclusion'. Bám theo chúng để biết đang ở ý nào."
  ],
  "steps": [
    "Đọc trước 5 câu hỏi để biết dàn ý bài nói (câu hỏi đi theo thứ tự).",
    "Nghe câu mở đầu thật kỹ: người nói thường nêu chủ đề và các ý sẽ trình bày.",
    "Ghi chú từ khoá theo từng ý, không cố ghi cả câu.",
    "Câu hỏi về quan điểm: nghe các cụm 'I believe', 'in my view', 'it's a mistake to think'."
  ],
  "tips": [
    "Ví dụ ('for instance') thường dùng để minh hoạ cho ý vừa nói trước đó; câu hỏi 'Why does the speaker mention X?' hỏi chức năng của ví dụ.",
    "Kết luận ('so', 'overall', 'to sum up') thường chứa đáp án câu hỏi ý chính.",
    "Nếu lỡ một câu, bỏ qua và bám câu sau; đừng để mất cả bài."
  ],
  "traps": [
    "Nhầm ý kiến người khác được người nói nhắc lại với ý kiến của người nói.",
    "Chọn chi tiết đúng nhưng không trả lời câu hỏi ý chính.",
    "Mất dấu khi người nói quay lại ý trước."
  ],
  "time": "khoảng 4–5 phút mỗi bài"
}
