{
  "id": "k-r4",
  "lesson": [
    "Phần 4 Đọc là một bài ngắn có 6 chỗ trống. Mỗi chỗ có 3 từ để chọn. Đây là phần kiểm cách dùng từ: từ nào đúng nghĩa VÀ đi đúng với từ đứng quanh nó.",
    "Ba từ thường gần nghĩa (say / tell / speak) hoặc cùng loại (in / on / at). Phải đọc cả câu, có khi cả câu sau, mới chọn đúng."
  ],
  "steps": [
    "Đọc cả bài một lượt, chưa chọn.",
    "Với mỗi chỗ trống, đọc từ ngay trước và ngay sau: có cụm cố định nào không (take a photo, good at)?",
    "Thử đặt từng từ vào, đọc to trong đầu cả câu.",
    "Kiểm lại nghĩa cả đoạn sau khi điền xong."
  ],
  "tips": [
    "Cụm động từ + danh từ hay gặp: make a mistake, do homework, take a bus, spend time.",
    "Giới từ đi theo từ đứng trước: interested in, good at, afraid of.",
    "Đọc cả câu sau chỗ trống: có khi từ cần chọn phụ thuộc vào ý ở câu tiếp theo."
  ],
  "traps": [
    "Chọn từ đúng nghĩa tiếng Việt nhưng sai cách dùng (say me → tell me).",
    "Chỉ đọc nửa câu có chỗ trống."
  ],
  "time": "khoảng 6 phút"
}
