{
  "id": "k-r3",
  "lesson": [
    "Phần 3 Đọc là một bài dài hơn (khoảng 200–260 từ): bài báo, bài kể chuyện về một người. Có 5 câu hỏi, mỗi câu 3 phương án.",
    "Câu hỏi đi theo thứ tự bài. Có câu hỏi chi tiết (khi nào, vì sao) và câu hỏi cảm nghĩ (người đó thấy thế nào)."
  ],
  "steps": [
    "Đọc nhanh cả bài để biết bài nói về ai, chuyện gì.",
    "Đọc câu hỏi 1, tìm đoạn tương ứng (câu hỏi theo thứ tự bài).",
    "Đọc kỹ đoạn đó, so từng phương án; loại phương án sai bằng chữ trong bài.",
    "Làm tương tự với các câu sau."
  ],
  "tips": [
    "Câu hỏi 'How did she feel…' cần tìm tính từ cảm xúc hoặc câu cho thấy cảm xúc.",
    "Phương án sai thường đúng với một người khác hoặc một thời điểm khác trong bài.",
    "Đọc câu đầu và câu cuối mỗi đoạn để biết đoạn đó nói gì, giúp tìm nhanh chỗ chứa đáp án."
  ],
  "traps": [
    "Trả lời bằng hiểu biết chung thay vì điều bài viết nói.",
    "Lẫn điều nhân vật muốn làm với điều đã làm."
  ],
  "time": "khoảng 10 phút"
}
