{
  "id": "k-l3",
  "lesson": [
    "Phần 3 Nghe là một hội thoại dài hơn giữa hai người quen nhau. Có 5 câu hỏi, mỗi câu 3 phương án, theo thứ tự hội thoại.",
    "Câu hỏi về kế hoạch, lý do, cảm nghĩ. Người nói có thể nhắc cả ba phương án; nghe xem họ đồng ý hay bác bỏ."
  ],
  "steps": [
    "Đọc 5 câu hỏi trước, biết hội thoại nói về chuyện gì.",
    "Nghe theo thứ tự câu hỏi; trả lời xong câu này thì chuyển ngay sang câu sau.",
    "Để ý ý kiến của người thứ hai: 'Really? I think…', 'That's a good idea, but…'.",
    "Chọn theo điều cả hai chốt."
  ],
  "tips": [
    "'I'd prefer', 'Let's', 'Why don't we' báo một kế hoạch.",
    "Câu hỏi 'Why…' thường có đáp án sau 'because', 'so'.",
    "Tên người, nơi chốn trong câu hỏi giúp bạn biết hội thoại đang tới câu nào."
  ],
  "traps": [
    "Chọn điều một người đề xuất nhưng người kia không đồng ý.",
    "Mải nghĩ câu trước nên lỡ câu sau."
  ],
  "time": "khoảng 3 phút"
}
